{
  "id": "xpu-gaudi-fusion-pass",
  "type": "flop",
  "name": "Gaudi Fusion Pass: Operator Fusion on SynapseAI",
  "class": "custom_kernel",
  "bound_by": "memory",
  "scales_with": ["num_layers", "hidden_size", "ffn_hidden_size"],
  "affected_by_hardware": ["intel-gaudi2", "intel-gaudi3", "hpu"],
  "workarounds": ["Use torch.compile to trigger automatic fusion", "Use the vLLM Gaudi plugin's custom fused kernels (hpu_fused_moe, hpu_layernorm)"],
  "notes": "The SynapseAI compiler on Gaudi performs operator fusion automatically when shapes are static. Common fusions include: LayerNorm + Linear, MatMul + Bias + Activation, and attention kernel fusion. The vLLM Gaudi plugin registers custom fused kernels: hpu_fused_moe (fused Mixture-of-Experts), hpu_layernorm (fused layer normalization), hpu_rotary_embedding (fused RoPE), hpu_mamba_mixer2 (fused Mamba mixer). These custom ops are not available on CUDA or ROCm. The fusion pass is most effective when combined with HPU graphs: the graph captures the fused kernels as a single unit, eliminating both launch overhead and intermediate memory traffic. For llama.cpp on Intel GPUs, the SYCL backend uses oneDNN for GEMM operations and performs fusion at the graph level via oneDNN Graph API. The fusion pass is a key reason Gaudi can achieve competitive inference throughput despite lower peak TFLOPS than NVIDIA: by reducing memory traffic and launch overhead, the effective throughput approaches the memory bandwidth limit. RESOLVED (2026-10-04 cross-reference repair): affected_by_hardware values 'gaudi-2' -> intel-gaudi2 and 'gaudi-3' -> intel-gaudi3. Each value is the architecture string of exactly one accelerator record and this repo holds one card per Gaudi generation, so the mapping is forced - note it is forced by the repo's contents, not by the source document. STILL LEFT UNRESOLVED in the same field: 'hpu', which names the Habana Processing Unit device class rather than any card, is redundant with the two Gaudi entries, and would resolve to either intel-gaudi2 or intel-gaudi3. Left unchanged rather than guessed.",
  "status": "verified",
  "confidence": 0.8,
  "updated": "2026-10-04",
  "sources": ["xpu-vllm-gaudi-readme", "xpu-vllm-gaudi-plugin-system"]
}
